{"schema_version":"1.0","package_version":"1.0.0","applies_to":"TLC-FC-35-FIDELITY-TO-INVARIANT-CORE-006","scientific_sources":[{"path":"maths/35-fidelity-to-invariant-core/fidelity-to-the-invariant-core.md","role":"authoritative source","fingerprint":{"algorithm":"git_blob_sha1","value":"5a6e0dcdcbc66bd74bb7d6816d34f2bcd0e73817"}},{"path":"maths/04-invariants/invariants.md","role":"normative projection-provider domain source","fingerprint":{"algorithm":"git_blob_sha1","value":"5bddc38b4a74465c2bc3b1d2e9f8aac004e86800"}}],"mathematical_contracts":[{"path":"registry/math-contracts/TLC-FC-35-FIDELITY-TO-INVARIANT-CORE-006/contract.yaml","role":"mathematical contract"}],"source_irs":[{"path":"ir/TLC-FC-35-FIDELITY-TO-INVARIANT-CORE-006/ir.candidate.json","role":"candidate IR"},{"path":"registry/ir/TLC-FC-35-FIDELITY-TO-INVARIANT-CORE-006/ir.yaml","role":"registered IR"}],"finalized_irs":[{"path":"registry/optimized-ir/fidelity-to-invariant-core/TLC-FC-35-FIDELITY-TO-INVARIANT-CORE-006/ir.yaml","role":"optimized IR"}],"algorithm_specifications":[{"path":"registry/algorithms/fidelity-to-invariant-core/TLC-FC-35-FIDELITY-TO-INVARIANT-CORE-006/algorithm.yaml","role":"guarded minimum evaluator"}],"test_plans":[{"path":"registry/test-plans/TLC-FC-35-FIDELITY-TO-INVARIANT-CORE-006/test-plan.yaml","role":"test plan"}],"acceptance_oracles":[{"path":"registry/oracles/fidelity-to-invariant-core/TLC-FC-35-FIDELITY-TO-INVARIANT-CORE-006/oracle.yaml","role":"oracle"}],"scientific_decisions":[{"path":"registry/scientific-objects/fidelity-to-invariant-core/unresolved-terms.yaml","role":"empty-set and provider boundary decisions"}]}
