{"schema_version":"1.0","package_version":"1.0.0","applies_to":"TLC-FC-34-TRANSMISSION-LIFECYCLE-001","scientific_sources":[{"path":"maths/34-transmission-lifecycle/operational-pipeline.md","role":"authoritative scientific source"},{"path":"maths/34-transmission-lifecycle/initiation-phase.md","role":"authoritative scientific source"},{"path":"maths/34-transmission-lifecycle/impregnation-phase.md","role":"authoritative scientific source"},{"path":"maths/34-transmission-lifecycle/guidance-phase.md","role":"authoritative scientific source"},{"path":"maths/34-transmission-lifecycle/incorporation-phase.md","role":"authoritative scientific source"},{"path":"maths/34-transmission-lifecycle/integration-phase.md","role":"authoritative scientific source"},{"path":"maths/34-transmission-lifecycle/validation-phase.md","role":"authoritative scientific source"},{"path":"maths/34-transmission-lifecycle/empowerment-phase.md","role":"authoritative scientific source"}],"mathematical_contracts":[{"path":"registry/math-contracts/TLC-FC-34-TRANSMISSION-LIFECYCLE-001/contract.yaml","role":"mathematical contract"}],"source_irs":[{"path":"ir/TLC-FC-34-TRANSMISSION-LIFECYCLE-001/ir.candidate.json","role":"candidate IR"}],"finalized_irs":[{"path":"registry/optimized-ir/transmission-lifecycle/TLC-FC-34-TRANSMISSION-LIFECYCLE-001/ir.yaml","role":"optimized IR"}],"algorithm_specifications":[{"path":"registry/algorithms/transmission-lifecycle/TLC-FC-34-TRANSMISSION-LIFECYCLE-001/algorithm.yaml","role":"algorithm or guard"}],"test_plans":[{"path":"registry/test-plans/TLC-FC-34-TRANSMISSION-LIFECYCLE-001/test-plan.yaml","role":"test plan"}],"acceptance_oracles":[{"path":"registry/oracles/transmission-lifecycle/TLC-FC-34-TRANSMISSION-LIFECYCLE-001/oracle.yaml","role":"oracle"}],"scientific_decisions":[{"path":"registry/domain-progress/transmission-lifecycle/feature-dependencies.yaml","role":"domain and provider boundary"},{"path":"registry/scientific-objects/transmission-lifecycle/symbol-collisions.yaml","role":"source-symbol identity boundary"},{"path":"registry/scientific-objects/transmission-lifecycle/phase-transitions.yaml","role":"phase-transition boundary"},{"path":"registry/domain-finalization/transmission-lifecycle/decision-required.yaml","role":"preserved unresolved decisions"}]}
