{"schema_version":"1.0","package_version":"1.0.0","applies_to":"TLC-FC-29-GENERATIONAL-PROPAGATION-027","scientific_sources":[{"path":"maths/29-generational-propagation/generational-propagation.md","role":"authoritative source"}],"mathematical_contracts":[{"path":"registry/math-contracts/TLC-FC-29-GENERATIONAL-PROPAGATION-027/contract.yaml","role":"mathematical contract"}],"source_irs":[{"path":"ir/TLC-FC-29-GENERATIONAL-PROPAGATION-027/ir.candidate.json","role":"candidate IR"}],"finalized_irs":[{"path":"registry/optimized-ir/generational-propagation/TLC-FC-29-GENERATIONAL-PROPAGATION-027/ir.yaml","role":"optimized IR"}],"algorithm_specifications":[{"path":"registry/algorithms/generational-propagation/TLC-FC-29-GENERATIONAL-PROPAGATION-027/algorithm.yaml","role":"algorithm or guard"}],"test_plans":[{"path":"registry/test-plans/TLC-FC-29-GENERATIONAL-PROPAGATION-027/test-plan.yaml","role":"test plan"}],"acceptance_oracles":[{"path":"registry/oracles/generational-propagation/TLC-FC-29-GENERATIONAL-PROPAGATION-027/oracle.yaml","role":"oracle"}],"scientific_decisions":[{"path":"registry/domain-progress/generational-propagation/feature-dependencies.yaml","role":"dependency boundary"}]}