{"schema_version":"1.0","package_version":"1.0.0","applies_to":"TLC-FC-08-PRINCIPLE-008","scientific_sources":[{"path":"maths/08-principle/principle.md","role":"Authoritative source ranges for formalization levels, cognitive functions, Gamma, M=f_P(D), and non-redundance."}],"mathematical_contracts":[{"path":"registry/math-contracts/TLC-FC-08-PRINCIPLE-008/contract.yaml","role":"Authoritative limited engineering contract.","artifact_id":"TLC-MC-TLC-FC-08-PRINCIPLE-008"}],"source_irs":[{"path":"registry/ir/TLC-FC-08-PRINCIPLE-008/ir.yaml","role":"Active prototype IR with reservations.","artifact_id":"TLC-IR-TLC-FC-08-PRINCIPLE-008-PROTOTYPE-001"}],"finalized_irs":[{"path":"registry/optimized-ir/principle/TLC-FC-08-PRINCIPLE-008/ir.yaml","role":"Finalized operator-catalog IR."}],"algorithm_specifications":[{"path":"registry/algorithms/principle/TLC-FC-08-PRINCIPLE-008/algorithm.yaml","role":"Applicable seven-record construction and operator-invocation rejection branches."}],"test_plans":[{"path":"registry/test-plans/TLC-FC-08-PRINCIPLE-008/test-plan.yaml","role":"Exact operator-record, non-invocation, opacity, and error plan.","artifact_id":"TLC-TP-TLC-FC-08-PRINCIPLE-008-PROTOTYPE-001"}],"acceptance_oracles":[{"path":"registry/oracles/principle/TLC-FC-08-PRINCIPLE-008/oracle.yaml","role":"Authoritative structural operator catalog oracle."}],"scientific_decisions":[{"path":"registry/domain-finalization/principle/feature-status.yaml","role":"Authoritative active population."},{"path":"registry/domain-finalization/principle/module-specification.yaml","role":"Separates representation from operator execution."},{"path":"registry/domain-finalization/principle/implementation-tasks.yaml","role":"Operator catalog constructor without invocation."}]}
