{"schema_version":"1.0","package_version":"1.0.0","applies_to":"TLC-FC-23-MEMORY-004","scientific_sources":[{"path":"maths/23-memory/memory.md","role":"authoritative Memory scientific source"}],"mathematical_contracts":[{"path":"registry/math-contracts/TLC-FC-23-MEMORY-004/contract.yaml","role":"mathematical contract"}],"source_irs":[{"path":"registry/ir/TLC-FC-23-MEMORY-004/ir.yaml","role":"registered source IR"}],"finalized_irs":[{"path":"registry/optimized-ir/memory/TLC-FC-23-MEMORY-004/ir.yaml","role":"finalized IR"}],"algorithm_specifications":[{"path":"registry/algorithms/memory/TLC-FC-23-MEMORY-004/algorithm.yaml","role":"source formula algorithm"}],"test_plans":[{"path":"registry/test-plans/TLC-FC-23-MEMORY-004/test-plan.yaml","role":"test plan"}],"acceptance_oracles":[{"path":"registry/oracles/memory/TLC-FC-23-MEMORY-004/oracle.yaml","role":"oracle"}],"scientific_decisions":[{"path":"registry/domain-finalization/memory/feature-status.yaml","role":"frozen scientific status"}]}
