{
  "schema_version": "1.0",
  "package_version": "1.0.0",
  "applies_to": "TLC-FC-00-MASTER-009",
  "scientific_sources": [
    {
      "path": "maths/00-master/master.md",
      "role": "Authoritative scientific source sections cited by the mathematical contract."
    }
  ],
  "mathematical_contracts": [
    {
      "path": "registry/math-contracts/TLC-FC-00-MASTER-009/contract.yaml",
      "role": "Authoritative candidate mathematical contract.",
      "artifact_id": "TLC-MC-TLC-FC-00-MASTER-009",
      "fingerprint": {
        "algorithm": "git_blob_sha1",
        "value": "d14b09d55392c8f0402b4b6a60bf23077ced8284"
      }
    }
  ],
  "source_irs": [
    {
      "path": "registry/ir/TLC-FC-00-MASTER-009/ir.yaml",
      "role": "Active source IR registry entry.",
      "artifact_id": "TLC-IR-REGISTRY-TLC-FC-00-MASTER-009",
      "fingerprint": {
        "algorithm": "git_blob_sha1",
        "value": "edf4b4eb5d2d5a43a5f5853af1d454c0eb43b1d7"
      }
    },
    {
      "path": "ir/TLC-FC-00-MASTER-009/ir.candidate.json",
      "role": "Candidate source IR preserving scientific reservations.",
      "artifact_id": "TLC-IR-TLC-FC-00-MASTER-009",
      "fingerprint": {
        "algorithm": "git_blob_sha1",
        "value": "a40a5921338b61e84296fa1fce0985603ee3331d"
      }
    }
  ],
  "finalized_irs": [
    {
      "path": "registry/optimized-ir/master/TLC-FC-00-MASTER-009/ir.yaml",
      "role": "Finalized implementation-facing IR.",
      "artifact_id": "TLC-OIR-TLC-FC-00-MASTER-009",
      "fingerprint": {
        "algorithm": "git_blob_sha1",
        "value": "14fd248199edfa02096250abd20166cd19c03047"
      }
    }
  ],
  "algorithm_specifications": [
    {
      "path": "registry/algorithms/master/TLC-FC-00-MASTER-009/algorithm.yaml",
      "role": "Applicable validation, dependency, provider, and preservation branches.",
      "artifact_id": "TLC-ALG-TLC-FC-00-MASTER-009",
      "fingerprint": {
        "algorithm": "git_blob_sha1",
        "value": "4b939c0b6f7cae3f5f5ac964bf2d642a5528e0aa"
      }
    }
  ],
  "test_plans": [
    {
      "path": "registry/test-plans/TLC-FC-00-MASTER-009/test-plan.yaml",
      "role": "Structural conformance and reservation-preservation plan.",
      "artifact_id": "TLC-TP-TLC-FC-00-MASTER-009",
      "fingerprint": {
        "algorithm": "git_blob_sha1",
        "value": "89c9aa34990d019e0bcb67a8f12bc9973e703725"
      }
    }
  ],
  "acceptance_oracles": [
    {
      "path": "registry/oracles/master/TLC-FC-00-MASTER-009/oracle.yaml",
      "role": "Authoritative fixtures and observable acceptance properties.",
      "artifact_id": "TLC-ORACLE-TLC-FC-00-MASTER-009",
      "fingerprint": {
        "algorithm": "git_blob_sha1",
        "value": "24dcefb18072766ceab5a3c9527df753bf3f61d2"
      }
    }
  ],
  "scientific_decisions": [
    {
      "path": "registry/domain-finalization/master/feature-status.yaml",
      "role": "Authoritative selected Master population and implementation mode."
    },
    {
      "path": "registry/domain-finalization/master/module-specification.yaml",
      "role": "Defines common envelopes, errors, interfaces, effects, and external dependencies."
    },
    {
      "path": "registry/domain-finalization/master/implementation-tasks.yaml",
      "role": "Defines the implementation deliverable and oracle for this feature."
    }
  ]
}
