{"schema_version":"1.0","package_version":"1.0.0","applies_to":"TLC-FC-09-VALUES-012","scientific_sources":[{"path":"maths/09-values/values.md","role":"cited value spaces and structures","line_range":{"start":213,"end":219},"artifact_id":"TLC-SO-VALUES-037"}],"mathematical_contracts":[{"path":"registry/math-contracts/TLC-FC-09-VALUES-012/contract.yaml","role":"authoritative limited engineering contract","artifact_id":"TLC-MC-TLC-FC-09-VALUES-012","fingerprint":{"algorithm":"git_blob_sha1","value":"a96ec8c7b146a0a091ea909e4e3531a2d72d74a9"}}],"source_irs":[{"path":"registry/ir/TLC-FC-09-VALUES-012/ir.yaml","role":"active source prototype IR","artifact_id":"TLC-IR-TLC-FC-09-VALUES-012","fingerprint":{"algorithm":"git_blob_sha1","value":"dc2950c51b94544bafd21a09e5c08f631b7c85e5"}}],"finalized_irs":[{"path":"registry/optimized-ir/values/TLC-FC-09-VALUES-012/ir.yaml","role":"finalized implementation-oriented IR","fingerprint":{"algorithm":"git_blob_sha1","value":"f48feb35f9ab0a7eff7f23ffd7b0efc96fa4ee3e"}}],"algorithm_specifications":[{"path":"registry/algorithms/values/TLC-FC-09-VALUES-012/algorithm.yaml","role":"identity-separation and no-geometry-invention evidence","fingerprint":{"algorithm":"git_blob_sha1","value":"0f3057780f0a5de045866d0d2f53046ff519afd3"}}],"test_plans":[{"path":"registry/test-plans/TLC-FC-09-VALUES-012/test-plan.yaml","role":"source operation test plan","artifact_id":"TLC-TP-TLC-FC-09-VALUES-012","fingerprint":{"algorithm":"git_blob_sha1","value":"77ad7fa9e8c40f52edd2ce9c2273910054e59d3d"}}],"acceptance_oracles":[{"path":"registry/oracles/values/TLC-FC-09-VALUES-012/oracle.yaml","role":"structural acceptance oracle","fingerprint":{"algorithm":"git_blob_sha1","value":"9f611ee85674d948f3b68c0bc471bf49b51a383b"}}],"scientific_decisions":[{"path":"registry/domain-finalization/values/feature-status.yaml","role":"authoritative inventory and status"},{"path":"registry/domain-finalization/values/module-specification.yaml","role":"domain operation and non-invention policy"},{"path":"registry/domain-finalization/values/patterns.yaml","role":"preservation and ordering rules"},{"path":"registry/domain-finalization/values/decision-required.yaml","role":"preserved unresolved decisions"}]}