{"schema_version":"1.0","package_version":"1.0.0","applies_to":"TLC-FC-16-COHORT-011","scientific_sources":[{"path":"maths/16-cohort/cohort.md","role":"authoritative Cohort scientific source"}],"mathematical_contracts":[{"path":"registry/math-contracts/TLC-FC-16-COHORT-011/contract.yaml","role":"language-neutral mathematical contract"}],"source_irs":[{"path":"registry/ir/TLC-FC-16-COHORT-011/ir.yaml","role":"registered source IR"}],"finalized_irs":[{"path":"registry/optimized-ir/cohort/TLC-FC-16-COHORT-011/ir.yaml","role":"finalized implementation-facing IR"}],"algorithm_specifications":[{"path":"registry/algorithms/cohort/TLC-FC-16-COHORT-011/algorithm.yaml","role":"source RHS algorithm specification"}],"test_plans":[{"path":"registry/test-plans/TLC-FC-16-COHORT-011/test-plan.yaml","role":"contract-derived test plan"}],"acceptance_oracles":[{"path":"registry/oracles/cohort/TLC-FC-16-COHORT-011/oracle.yaml","role":"acceptance oracle"}],"scientific_decisions":[{"path":"registry/domain-finalization/cohort/feature-status.yaml","role":"frozen feature population and scientific status"}]}
