{"schema_version":"1.0","package_version":"1.0.0","applies_to":"TLC-FC-30-EXPANSION-021","scientific_sources":[{"path":"maths/30-expansion/expansion.md","role":"authoritative scientific source"}],"mathematical_contracts":[{"path":"registry/math-contracts/TLC-FC-30-EXPANSION-021/contract.yaml","role":"mathematical contract"}],"source_irs":[{"path":"ir/TLC-FC-30-EXPANSION-021/ir.candidate.json","role":"candidate IR"}],"finalized_irs":[{"path":"registry/optimized-ir/expansion/TLC-FC-30-EXPANSION-021/ir.yaml","role":"optimized IR"}],"algorithm_specifications":[{"path":"registry/algorithms/expansion/TLC-FC-30-EXPANSION-021/algorithm.yaml","role":"algorithm or guard"}],"test_plans":[{"path":"registry/test-plans/TLC-FC-30-EXPANSION-021/test-plan.yaml","role":"test plan"}],"acceptance_oracles":[{"path":"registry/oracles/expansion/TLC-FC-30-EXPANSION-021/oracle.yaml","role":"oracle"}],"scientific_decisions":[{"path":"registry/domain-progress/expansion/feature-dependencies.yaml","role":"domain and provider boundary"}]}