{"schema_version":"1.0","package_version":"1.0.0","applies_to":"TLC-FC-19-REGULATION-008","scientific_sources":[{"path":"maths/19-regulation/regulation.md","role":"authoritative source","fingerprint":{"algorithm":"git_blob_sha1","value":"198377f05ad085c2fae940d9a7d78767d01e0537"}}],"mathematical_contracts":[{"path":"registry/math-contracts/TLC-FC-19-REGULATION-008/contract.yaml","role":"feature contract"}],"source_irs":[{"path":"ir/TLC-FC-19-REGULATION-008/ir.candidate.json","role":"candidate IR"},{"path":"registry/ir/TLC-FC-19-REGULATION-008/ir.yaml","role":"registered IR"}],"finalized_irs":[{"path":"registry/optimized-ir/regulation/TLC-FC-19-REGULATION-008/ir.yaml","role":"optimized IR"}],"algorithm_specifications":[{"path":"registry/algorithms/regulation/TLC-FC-19-REGULATION-008/algorithm.yaml","role":"RHS evaluator"}],"test_plans":[{"path":"registry/test-plans/TLC-FC-19-REGULATION-008/test-plan.yaml","role":"test plan"}],"acceptance_oracles":[{"path":"registry/oracles/regulation/TLC-FC-19-REGULATION-008/oracle.yaml","role":"sign-preserving oracle"}],"scientific_decisions":[{"path":"registry/scientific-objects/regulation/unresolved-terms.yaml","role":"spaces perturbation and calculus boundaries"},{"path":"registry/math-contracts/TLC-FC-19-REGULATION-016/contract.yaml","role":"negative-A contradiction boundary"}]}
