{"schema_version":"1.0","package_version":"1.0.0","applies_to":"TLC-FC-18-EVALUATION-005","scientific_sources":[{"path":"maths/18-evaluation/evaluation.md","role":"authoritative integrated progression index"}],"mathematical_contracts":[{"path":"registry/math-contracts/TLC-FC-18-EVALUATION-005/contract.yaml","role":"feature mathematical contract"}],"source_irs":[{"path":"ir/TLC-FC-18-EVALUATION-005/ir.candidate.json","role":"candidate IR"},{"path":"registry/ir/TLC-FC-18-EVALUATION-005/ir.yaml","role":"registered IR"}],"finalized_irs":[{"path":"registry/optimized-ir/evaluation/TLC-FC-18-EVALUATION-005/ir.yaml","role":"optimized IR"}],"algorithm_specifications":[{"path":"registry/algorithms/evaluation/TLC-FC-18-EVALUATION-005/algorithm.yaml","role":"guarded integrated expression algorithm"}],"test_plans":[{"path":"registry/test-plans/TLC-FC-18-EVALUATION-005/test-plan.yaml","role":"test plan"}],"acceptance_oracles":[{"path":"registry/oracles/evaluation/TLC-FC-18-EVALUATION-005/oracle.yaml","role":"acceptance oracle"}],"scientific_decisions":[{"path":"registry/scientific-objects/evaluation/unresolved-terms.yaml","role":"M_r normalizer and metric-reference gaps"},{"path":"registry/domain-progress/evaluation/feature-dependencies.yaml","role":"structural guard dependency"}]}
