{"schema_version":"1.0","package_version":"1.0.0","applies_to":"TLC-FC-31-INSTITUTIONALIZATION-031","scientific_sources":[{"path":"maths/31-institutionalization/institutionalization.md","role":"authoritative scientific source"}],"mathematical_contracts":[{"path":"registry/math-contracts/TLC-FC-31-INSTITUTIONALIZATION-031/contract.yaml","role":"mathematical contract"}],"source_irs":[{"path":"ir/TLC-FC-31-INSTITUTIONALIZATION-031/ir.candidate.json","role":"candidate IR"}],"finalized_irs":[{"path":"registry/optimized-ir/institutionalization/TLC-FC-31-INSTITUTIONALIZATION-031/ir.yaml","role":"optimized IR"}],"algorithm_specifications":[{"path":"registry/algorithms/institutionalization/TLC-FC-31-INSTITUTIONALIZATION-031/algorithm.yaml","role":"algorithm or guard"}],"test_plans":[{"path":"registry/test-plans/TLC-FC-31-INSTITUTIONALIZATION-031/test-plan.yaml","role":"test plan"}],"acceptance_oracles":[{"path":"registry/oracles/institutionalization/TLC-FC-31-INSTITUTIONALIZATION-031/oracle.yaml","role":"oracle"}],"scientific_decisions":[{"path":"registry/domain-progress/institutionalization/feature-dependencies.yaml","role":"domain and provider boundary"},{"path":"registry/domain-finalization/institutionalization/decision-required.yaml","role":"preserved unresolved decisions"}]}