{
 "schema_version":"1.0","package_version":"1.0.0","applies_to":"TLC-FC-03-HUIT-DIMENSIONS-DE-TL-013","scientific_sources":[{"path":"maths/03-huit-dimensions-de-tl.md","role":"Authoritative source ranges for activation, completeness, and necessity claims.","fingerprint":{"algorithm":"git_blob_sha1","value":"f2db0152d534a776e2bd7abeb19ddfb150f33dd8"}}],"mathematical_contracts":[{"path":"registry/math-contracts/TLC-FC-03-HUIT-DIMENSIONS-DE-TL-013/contract.yaml","role":"Authoritative limited engineering contract.","artifact_id":"TLC-LEC-TLC-FC-03-HUIT-DIMENSIONS-DE-TL-013-001","fingerprint":{"algorithm":"git_blob_sha1","value":"ed0e17c76916a88827a231bf2978a4192aecbf71"}}],"source_irs":[{"path":"ir/TLC-FC-03-HUIT-DIMENSIONS-DE-TL-013/ir.prototype.json","role":"Prototype IR preserving three obligations.","artifact_id":"TLC-IR-TLC-FC-03-HUIT-DIMENSIONS-DE-TL-013-PROTOTYPE-001","fingerprint":{"algorithm":"git_blob_sha1","value":"33ce4f2acd02684457bac8594e3914948b990b98"}}],"finalized_irs":[{"path":"registry/optimized-ir/huit-dimensions/TLC-FC-03-HUIT-DIMENSIONS-DE-TL-013/ir.yaml","role":"Finalized structural IR.","fingerprint":{"algorithm":"git_blob_sha1","value":"c3948383d8cd373f31d32fd6669a56398b582b4e"}}],"algorithm_specifications":[{"path":"registry/algorithms/huit-dimensions/TLC-FC-03-HUIT-DIMENSIONS-DE-TL-013/algorithm.yaml","role":"Applicable obligation-set branches.","fingerprint":{"algorithm":"git_blob_sha1","value":"6a13e63dfdea549c7bddf51616e44da2a0378a19"}}],"test_plans":[{"path":"ir/TLC-FC-03-HUIT-DIMENSIONS-DE-TL-013/test-plan.yaml","role":"Prototype structural test plan.","artifact_id":"TLC-TP-TLC-FC-03-HUIT-DIMENSIONS-DE-TL-013-PROTOTYPE-001","fingerprint":{"algorithm":"git_blob_sha1","value":"465ee607ce22da316fa2833fd71ff5be89883e95"}}],"acceptance_oracles":[{"path":"registry/oracles/huit-dimensions/TLC-FC-03-HUIT-DIMENSIONS-DE-TL-013/oracle.yaml","role":"Final structural acceptance oracle.","fingerprint":{"algorithm":"git_blob_sha1","value":"b0a7016f52134c3813823a90e42a1949fb4e1b8d"}}],"scientific_decisions":[{"path":"registry/domain-finalization/huit-dimensions/feature-status.yaml","role":"Authoritative active and deferred scientific status.","fingerprint":{"algorithm":"git_blob_sha1","value":"754e5408cbe7dd4bca7f6629607d9b23ae91b32c"}},{"path":"registry/domain-finalization/huit-dimensions/module-specification.yaml","role":"Domain-wide structural semantics and prohibitions.","fingerprint":{"algorithm":"git_blob_sha1","value":"5343276b712badd4fb3ab484416f855d338049dd"}},{"path":"registry/domain-finalization/huit-dimensions/implementation-tasks.yaml","role":"Developer and scientific follow-up obligations.","fingerprint":{"algorithm":"git_blob_sha1","value":"e46bc28b6e4b24083bff483cb335070d31a21391"}}]
}
