{"schema_version":"1.0","package_version":"1.0.0","applies_to":"TLC-FC-17-CASCADE-TRANSMISSION-052","scientific_sources":[{"path":"maths/17-cascade-transmission/cascade-transmission-system.md","role":"authoritative scientific source"}],"mathematical_contracts":[{"path":"registry/math-contracts/TLC-FC-17-CASCADE-TRANSMISSION-052/contract.yaml","role":"mathematical contract"}],"source_irs":[{"path":"ir/TLC-FC-17-CASCADE-TRANSMISSION-052/ir.candidate.json","role":"candidate IR"}],"finalized_irs":[{"path":"registry/optimized-ir/cascade-transmission/TLC-FC-17-CASCADE-TRANSMISSION-052/ir.yaml","role":"optimized IR"}],"algorithm_specifications":[{"path":"registry/algorithms/cascade-transmission/TLC-FC-17-CASCADE-TRANSMISSION-052/algorithm.yaml","role":"algorithm or guard"}],"test_plans":[{"path":"registry/test-plans/TLC-FC-17-CASCADE-TRANSMISSION-052/test-plan.yaml","role":"test plan"}],"acceptance_oracles":[{"path":"registry/oracles/cascade-transmission/TLC-FC-17-CASCADE-TRANSMISSION-052/oracle.yaml","role":"oracle"}],"scientific_decisions":[{"path":"registry/domain-progress/cascade-transmission/feature-dependencies.yaml","role":"domain and provider boundary"},{"path":"registry/domain-finalization/cascade-transmission/decision-required.yaml","role":"preserved unresolved decisions"}]}
