{
  "schema_version": "1.0", "package_version": "1.0.0", "applies_to": "TLC-FC-05-DYNAMICS-005",
  "scientific_sources": [{"path": "maths/05-dynamics.md", "role": "Community interaction-operator source", "line_range": {"start": 138, "end": 146}}],
  "mathematical_contracts": [{"path": "registry/math-contracts/TLC-FC-05-DYNAMICS-005/contract.yaml", "role": "Authoritative limited engineering contract", "artifact_id": "TLC-MC-TLC-FC-05-DYNAMICS-005"}],
  "source_irs": [{"path": "ir/TLC-FC-05-DYNAMICS-005/ir.prototype.json", "role": "Active prototype IR", "artifact_id": "TLC-IR-TLC-FC-05-DYNAMICS-005"}],
  "finalized_irs": [{"path": "registry/optimized-ir/dynamics/TLC-FC-05-DYNAMICS-005/ir.yaml", "role": "Final declarative structural IR", "artifact_id": "TLC-OPT-IR-TLC-FC-05-DYNAMICS-005"}],
  "algorithm_specifications": [{"path": "registry/algorithms/dynamics/TLC-FC-05-DYNAMICS-005/algorithm.yaml", "role": "Algorithm input compiled into observable and partial-order obligations", "artifact_id": "TLC-ALG-TLC-FC-05-DYNAMICS-005"}],
  "test_plans": [{"path": "registry/test-plans/TLC-FC-05-DYNAMICS-005/test-plan.yaml", "role": "Source structural test plan", "artifact_id": "TLC-TP-TLC-FC-05-DYNAMICS-005"}],
  "acceptance_oracles": [{"path": "registry/oracles/dynamics/TLC-FC-05-DYNAMICS-005/oracle.yaml", "role": "Authoritative structural property oracle", "artifact_id": "TLC-ORACLE-TLC-FC-05-DYNAMICS-005"}],
  "scientific_decisions": [
    {"path": "registry/domain-finalization/dynamics/decision-required.yaml", "role": "Preserves unresolved operator signatures and Community reconciliation", "artifact_id": "DYN-DEC-005"},
    {"path": "registry/domain-finalization/dynamics/module-specification.yaml", "role": "Domain-level operator operation and execution boundary"},
    {"path": "registry/domain-finalization/dynamics/patterns.yaml", "role": "Ordered opaque construction and no-transition decisions"}
  ]
}
