{
  "schema_version": "1.0", "package_version": "1.0.0", "applies_to": "TLC-FC-02-COMMUNITY-009",
  "scientific_sources": [{"path": "maths/02-community.md", "role": "primary scientific source", "title": "La Communauté (Community)", "section": "Définition formelle et espaces; Axiomes fondamentaux de la Communauté", "line_range": {"start": 36, "end": 85}}],
  "mathematical_contracts": [{"path": "registry/math-contracts/TLC-FC-02-COMMUNITY-009/contract.yaml", "role": "authoritative mathematical contract", "fingerprint": {"algorithm": "git_blob_sha1", "value": "5e9c542622377ba12a9774c457e3cce15170f7ca"}}],
  "source_irs": [{"path": "registry/ir/TLC-FC-02-COMMUNITY-009/ir.yaml", "role": "registered source IR"}, {"path": "ir/TLC-FC-02-COMMUNITY-009/ir.candidate.json", "role": "preserved candidate source IR"}],
  "finalized_irs": [{"path": "registry/optimized-ir/community/TLC-FC-02-COMMUNITY-009/ir.yaml", "role": "selected final implementation specification IR", "fingerprint": {"algorithm": "git_blob_sha1", "value": "c618642c93c9733e489bba7ec6502577d5d3e3e9"}}],
  "algorithm_specifications": [{"path": "registry/algorithms/community/TLC-FC-02-COMMUNITY-009/algorithm.yaml", "role": "algorithmic compilation input", "artifact_id": "TLC-ALG-COMMUNITY-009", "fingerprint": {"algorithm": "git_blob_sha1", "value": "1ef7c0c60147d33fac058ab91527c83f8f3cded3"}}],
  "test_plans": [{"path": "registry/test-plans/TLC-FC-02-COMMUNITY-009/test-plan.yaml", "role": "source test plan"}],
  "acceptance_oracles": [{"path": "registry/oracles/community/TLC-FC-02-COMMUNITY-009/oracle.yaml", "role": "authoritative structural acceptance oracle", "artifact_id": "TLC-ORACLE-COMMUNITY-009", "fingerprint": {"algorithm": "git_blob_sha1", "value": "7a5b654c5570dc7254157749f73f83087aba1bed"}}],
  "scientific_decisions": [{"path": "registry/domain-finalization/community/decision-required.yaml", "role": "domain scientific execution decisions"}, {"path": "registry/domain-finalization/community/manifest.yaml", "role": "authoritative population and unresolved set"}]
}