{"schema_version":"1.0","package_version":"1.0.0","applies_to":"TLC-FC-21-FAIRNESS-018","scientific_sources":[{"path":"maths/21-fairness/fairness.md","role":"authoritative source","fingerprint":{"algorithm":"git_blob_sha1","value":"bbe983d3f74063072c97059e8ff7346b28d28158"}},{"path":"maths/20-robustness/robustness.md","role":"downstream dependency evidence","fingerprint":{"algorithm":"git_blob_sha1","value":"71b575f114d1710b6b9556de06b17d103cb38c1e"}}],"mathematical_contracts":[{"path":"registry/math-contracts/TLC-FC-21-FAIRNESS-018/contract.yaml","role":"mathematical contract"}],"source_irs":[{"path":"ir/TLC-FC-21-FAIRNESS-018/ir.candidate.json","role":"candidate IR"},{"path":"registry/ir/TLC-FC-21-FAIRNESS-018/ir.yaml","role":"registered IR"}],"finalized_irs":[{"path":"registry/optimized-ir/fairness/TLC-FC-21-FAIRNESS-018/ir.yaml","role":"optimized IR"}],"algorithm_specifications":[{"path":"registry/algorithms/fairness/TLC-FC-21-FAIRNESS-018/algorithm.yaml","role":"algorithm or guard"}],"test_plans":[{"path":"registry/test-plans/TLC-FC-21-FAIRNESS-018/test-plan.yaml","role":"test plan"}],"acceptance_oracles":[{"path":"registry/oracles/fairness/TLC-FC-21-FAIRNESS-018/oracle.yaml","role":"oracle"}],"scientific_decisions":[{"path":"registry/scientific-objects/fairness/unresolved-terms.yaml","role":"preserved scientific limits"},{"path":"registry/domain-progress/fairness/feature-dependencies.yaml","role":"dependency direction decision"}]}
