{"schema_version":"1.0","package_version":"1.0.0","applies_to":"TLC-FC-28-FINALITY-AND-EVOLUTIONARY-TELEOLOGY-005","scientific_sources":[{"path":"maths/28-finality-and-evolutionary-teleology/finality-and-evolutionary-teleology.md","role":"authoritative source","fingerprint":{"algorithm":"git_blob_sha1","value":"4be0b562d872a206725ad4089dc3723d8f7e20ad"}}],"mathematical_contracts":[{"path":"registry/math-contracts/TLC-FC-28-FINALITY-AND-EVOLUTIONARY-TELEOLOGY-005/contract.yaml","role":"contract"}],"source_irs":[{"path":"ir/TLC-FC-28-FINALITY-AND-EVOLUTIONARY-TELEOLOGY-005/ir.candidate.json","role":"candidate"},{"path":"registry/ir/TLC-FC-28-FINALITY-AND-EVOLUTIONARY-TELEOLOGY-005/ir.yaml","role":"registered"}],"finalized_irs":[{"path":"registry/optimized-ir/finality-and-evolutionary-teleology/TLC-FC-28-FINALITY-AND-EVOLUTIONARY-TELEOLOGY-005/ir.yaml","role":"optimized"}],"algorithm_specifications":[{"path":"registry/algorithms/finality-and-evolutionary-teleology/TLC-FC-28-FINALITY-AND-EVOLUTIONARY-TELEOLOGY-005/algorithm.yaml","role":"algorithm"}],"test_plans":[{"path":"registry/test-plans/TLC-FC-28-FINALITY-AND-EVOLUTIONARY-TELEOLOGY-005/test-plan.yaml","role":"tests"}],"acceptance_oracles":[{"path":"registry/oracles/finality-and-evolutionary-teleology/TLC-FC-28-FINALITY-AND-EVOLUTIONARY-TELEOLOGY-005/oracle.yaml","role":"oracle"}],"scientific_decisions":[{"path":"registry/scientific-objects/finality-and-evolutionary-teleology/unresolved-terms.yaml","role":"boundaries"}]}
