{"schema_version":"1.0","package_version":"1.0.0","applies_to":"TLC-FC-32-DRIFT-AND-CORRECTION-014","scientific_sources":[{"path":"maths/32-drift-and-correction/stability-drift-and-correction.md","role":"authoritative source","fingerprint":{"algorithm":"git_blob_sha1","value":"c43d581fcbd33d086c1acb84ec43ac6d48ed95a3"}}],"mathematical_contracts":[{"path":"registry/math-contracts/TLC-FC-32-DRIFT-AND-CORRECTION-014/contract.yaml","role":"mathematical contract"}],"source_irs":[{"path":"ir/TLC-FC-32-DRIFT-AND-CORRECTION-014/ir.candidate.json","role":"candidate IR"},{"path":"registry/ir/TLC-FC-32-DRIFT-AND-CORRECTION-014/ir.yaml","role":"registered IR"}],"finalized_irs":[{"path":"registry/optimized-ir/drift-and-correction/TLC-FC-32-DRIFT-AND-CORRECTION-014/ir.yaml","role":"optimized IR"}],"algorithm_specifications":[{"path":"registry/algorithms/drift-and-correction/TLC-FC-32-DRIFT-AND-CORRECTION-014/algorithm.yaml","role":"predicate evaluator"}],"test_plans":[{"path":"registry/test-plans/TLC-FC-32-DRIFT-AND-CORRECTION-014/test-plan.yaml","role":"test plan"}],"acceptance_oracles":[{"path":"registry/oracles/drift-and-correction/TLC-FC-32-DRIFT-AND-CORRECTION-014/oracle.yaml","role":"oracle"}],"scientific_decisions":[{"path":"registry/scientific-objects/drift-and-correction/unresolved-terms.yaml","role":"reset provider boundary"},{"path":"registry/domain-progress/drift-and-correction/feature-dependencies.yaml","role":"no 32-to-35 dependency"}]}
