{"schema_version":"1.0","package_version":"1.0.0","applies_to":"TLC-FC-27-REFLEXIVITY-009","scientific_sources":[{"path":"maths/27-reflexivity/reflexivity.md","role":"authoritative contradictory sign formulas and unresolved crisis semantics"},{"path":"handoff/features/TLC-FC-26-IDENTITY-002/manifest.json","role":"published Phi_id authority"},{"path":"handoff/features/TLC-FC-26-IDENTITY-003/manifest.json","role":"published threshold authority"}],"mathematical_contracts":[{"path":"registry/math-contracts/TLC-FC-27-REFLEXIVITY-009/contract.yaml","role":"feature mathematical contract"}],"source_irs":[{"path":"ir/TLC-FC-27-REFLEXIVITY-009/ir.candidate.json","role":"candidate IR"},{"path":"registry/ir/TLC-FC-27-REFLEXIVITY-009/ir.yaml","role":"registered source IR"}],"finalized_irs":[{"path":"registry/optimized-ir/reflexivity/TLC-FC-27-REFLEXIVITY-009/ir.yaml","role":"optimized IR"}],"algorithm_specifications":[{"path":"registry/algorithms/reflexivity/TLC-FC-27-REFLEXIVITY-009/algorithm.yaml","role":"semantic ambiguity and crisis-lifecycle non-execution guard"}],"test_plans":[{"path":"registry/test-plans/TLC-FC-27-REFLEXIVITY-009/test-plan.yaml","role":"ambiguity and lifecycle guard test plan"}],"acceptance_oracles":[{"path":"registry/oracles/reflexivity/TLC-FC-27-REFLEXIVITY-009/oracle.yaml","role":"ambiguity and lifecycle oracle"}],"scientific_decisions":[{"path":"registry/scientific-objects/reflexivity/unresolved-terms.yaml","role":"source sign contradictions and crisis-lifecycle reservations"},{"path":"registry/domain-progress/reflexivity/feature-dependencies.yaml","role":"Identity dependency boundary"}]}
