{"schema_version":"1.0","package_version":"1.0.0","applies_to":"TLC-FC-19-REGULATION-001","scientific_sources":[{"path":"maths/19-regulation/regulation.md","role":"authoritative Regulation source","fingerprint":{"algorithm":"git_blob_sha1","value":"198377f05ad085c2fae940d9a7d78767d01e0537"}},{"path":"registry/math-contracts/TLC-FC-18-EVALUATION-001/contract.yaml","role":"published Evaluation validity semantics reused scientifically"}],"mathematical_contracts":[{"path":"registry/math-contracts/TLC-FC-19-REGULATION-001/contract.yaml","role":"authoritative feature contract"}],"source_irs":[{"path":"ir/TLC-FC-19-REGULATION-001/ir.candidate.json","role":"candidate IR"},{"path":"registry/ir/TLC-FC-19-REGULATION-001/ir.yaml","role":"registered IR"}],"finalized_irs":[{"path":"registry/optimized-ir/regulation/TLC-FC-19-REGULATION-001/ir.yaml","role":"optimized IR"}],"algorithm_specifications":[{"path":"registry/algorithms/regulation/TLC-FC-19-REGULATION-001/algorithm.yaml","role":"guarded predicate algorithm"}],"test_plans":[{"path":"registry/test-plans/TLC-FC-19-REGULATION-001/test-plan.yaml","role":"test plan"}],"acceptance_oracles":[{"path":"registry/oracles/regulation/TLC-FC-19-REGULATION-001/oracle.yaml","role":"acceptance oracle"}],"scientific_decisions":[{"path":"registry/domain-progress/regulation/feature-dependencies.yaml","role":"scientific and runtime dependency boundary"},{"path":"registry/scientific-objects/regulation/unresolved-terms.yaml","role":"unresolved threshold semantics"}]}
