{
  "schema_version": "1.0",
  "package_version": "1.0.0",
  "applies_to": "TLC-FC-03-HUIT-DIMENSIONS-DE-TL-001",
  "scientific_sources": [{"path": "maths/03-huit-dimensions-de-tl/huit-dimensions-de-tl.md", "role": "Authoritative scientific source ranges for the three Principle declarations.", "fingerprint": {"algorithm": "git_blob_sha1", "value": "f2db0152d534a776e2bd7abeb19ddfb150f33dd8"}}],
  "mathematical_contracts": [{"path": "registry/math-contracts/TLC-FC-03-HUIT-DIMENSIONS-DE-TL-001/contract.yaml", "role": "Authoritative limited engineering contract.", "artifact_id": "TLC-LEC-TLC-FC-03-HUIT-DIMENSIONS-DE-TL-001-001", "fingerprint": {"algorithm": "git_blob_sha1", "value": "f2806120c36c7773f08772e79d7d106dfb2245da"}}],
  "source_irs": [{"path": "ir/TLC-FC-03-HUIT-DIMENSIONS-DE-TL-001/ir.prototype.json", "role": "Prototype IR preserving reservations.", "artifact_id": "TLC-IR-TLC-FC-03-HUIT-DIMENSIONS-DE-TL-001-PROTOTYPE-001", "fingerprint": {"algorithm": "git_blob_sha1", "value": "ab4a11a51c1afa65ec95e7d38f01aa66dccf19cf"}}],
  "finalized_irs": [{"path": "registry/optimized-ir/huit-dimensions/TLC-FC-03-HUIT-DIMENSIONS-DE-TL-001/ir.yaml", "role": "Finalized implementation-facing structural IR.", "fingerprint": {"algorithm": "git_blob_sha1", "value": "695c82a6ddc9f1557814431ec4fe994e53f35911"}}],
  "algorithm_specifications": [{"path": "registry/algorithms/huit-dimensions/TLC-FC-03-HUIT-DIMENSIONS-DE-TL-001/algorithm.yaml", "role": "Applicable validation, construction, and preservation branches.", "fingerprint": {"algorithm": "git_blob_sha1", "value": "fbbb31f73028493ae1d4f72ef8b2302f3f6c83f7"}}],
  "test_plans": [{"path": "ir/TLC-FC-03-HUIT-DIMENSIONS-DE-TL-001/test-plan.yaml", "role": "Prototype structural test plan.", "artifact_id": "TLC-TP-TLC-FC-03-HUIT-DIMENSIONS-DE-TL-001-PROTOTYPE-001", "fingerprint": {"algorithm": "git_blob_sha1", "value": "efbf390c8fd64e016ec0833b4e979276d661cbe7"}}],
  "acceptance_oracles": [{"path": "registry/oracles/huit-dimensions/TLC-FC-03-HUIT-DIMENSIONS-DE-TL-001/oracle.yaml", "role": "Final structural acceptance oracle.", "fingerprint": {"algorithm": "git_blob_sha1", "value": "47e6654ff4cb75bdb223c9892bce182b9f050df3"}}],
  "scientific_decisions": [
    {"path": "registry/domain-finalization/huit-dimensions/feature-status.yaml", "role": "Authoritative active population and retained status.", "fingerprint": {"algorithm": "git_blob_sha1", "value": "754e5408cbe7dd4bca7f6629607d9b23ae91b32c"}},
    {"path": "registry/domain-finalization/huit-dimensions/module-specification.yaml", "role": "Domain-wide structural semantics and prohibitions.", "fingerprint": {"algorithm": "git_blob_sha1", "value": "5343276b712badd4fb3ab484416f855d338049dd"}},
    {"path": "registry/domain-finalization/huit-dimensions/implementation-tasks.yaml", "role": "Developer handoff and verification obligations.", "fingerprint": {"algorithm": "git_blob_sha1", "value": "e46bc28b6e4b24083bff483cb335070d31a21391"}}
  ]
}
