{
  "schema_version": "1.0", "package_version": "1.0.0", "applies_to": "TLC-FC-06-THEOREMS-006",
  "scientific_sources": [
    {"path": "maths/06-theorems.md", "role": "Indexed declaration source 1", "line_range": {"start": 13, "end": 16}},
    {"path": "maths/06-theorems.md", "role": "Indexed declaration source 2", "line_range": {"start": 31, "end": 38}},
    {"path": "maths/06-theorems.md", "role": "Indexed declaration source 3", "line_range": {"start": 49, "end": 52}},
    {"path": "maths/06-theorems.md", "role": "Indexed declaration source 4", "line_range": {"start": 92, "end": 95}},
    {"path": "maths/06-theorems.md", "role": "Indexed declaration source 5", "line_range": {"start": 114, "end": 124}},
    {"path": "maths/06-theorems.md", "role": "Indexed declaration source 6", "line_range": {"start": 129, "end": 136}}
  ],
  "mathematical_contracts": [{"path": "registry/math-contracts/TLC-FC-06-THEOREMS-006/contract.yaml", "role": "Authoritative limited engineering contract", "artifact_id": "TLC-LEC-TLC-FC-06-THEOREMS-006-001"}],
  "source_irs": [{"path": "registry/ir/TLC-FC-06-THEOREMS-006/ir.yaml", "role": "Preserved prototype IR", "artifact_id": "TLC-PIR-TLC-FC-06-THEOREMS-006-001"}],
  "finalized_irs": [{"path": "registry/optimized-ir/theorems/TLC-FC-06-THEOREMS-006/ir.yaml", "role": "Finalized implementation IR and exact proof-status map"}],
  "algorithm_specifications": [{"path": "registry/algorithms/theorems/TLC-FC-06-THEOREMS-006/algorithm.yaml", "role": "Index and lookup algorithm input interpreted conservatively"}],
  "test_plans": [{"path": "registry/test-plans/TLC-FC-06-THEOREMS-006/test-plan.yaml", "role": "Source structural test plan", "artifact_id": "TLC-TP-TLC-FC-06-THEOREMS-006-001"}],
  "acceptance_oracles": [{"path": "registry/oracles/theorems/TLC-FC-06-THEOREMS-006/oracle.yaml", "role": "Authoritative population, proof-status, lookup, and quantifier oracle"}],
  "scientific_decisions": [{"path": "registry/domain-finalization/theorems/module-specification.yaml", "role": "Proof-status, quantifier, external dependency, and no-truth decisions"}]
}
