{"schema_version":"1.0","package_version":"1.0.0","applies_to":"TLC-FC-09-VALUES-008","scientific_sources":[{"path":"maths/09-values.md","role":"fundamental-principle preservation claim","line_range":{"start":17,"end":17},"artifact_id":"TLC-SO-VALUES-041"}],"mathematical_contracts":[{"path":"registry/math-contracts/TLC-FC-09-VALUES-008/contract.yaml","role":"authoritative limited engineering contract","artifact_id":"TLC-MC-TLC-FC-09-VALUES-008","fingerprint":{"algorithm":"git_blob_sha1","value":"3240e227ea5a320a28464a4df10aed632edf522e"}}],"source_irs":[{"path":"registry/ir/TLC-FC-09-VALUES-008/ir.yaml","role":"active source prototype IR","artifact_id":"TLC-IR-TLC-FC-09-VALUES-008","fingerprint":{"algorithm":"git_blob_sha1","value":"c63aacd8c02333909f832953d0d31739a18beaa0"}}],"finalized_irs":[{"path":"registry/optimized-ir/values/TLC-FC-09-VALUES-008/ir.yaml","role":"finalized implementation-oriented IR","fingerprint":{"algorithm":"git_blob_sha1","value":"f9974a354d0b96f0367fea9d7ada17eaf874d2f5"}}],"algorithm_specifications":[{"path":"registry/algorithms/values/TLC-FC-09-VALUES-008/algorithm.yaml","role":"source-declared symbolic comparison evidence","fingerprint":{"algorithm":"git_blob_sha1","value":"b5e6a88b1822ff50e75d506dca5c93db9ed0e804"}}],"test_plans":[{"path":"registry/test-plans/TLC-FC-09-VALUES-008/test-plan.yaml","role":"source operation test plan","artifact_id":"TLC-TP-TLC-FC-09-VALUES-008","fingerprint":{"algorithm":"git_blob_sha1","value":"049b8253300a065e950225272aa6b4974228173f"}}],"acceptance_oracles":[{"path":"registry/oracles/values/TLC-FC-09-VALUES-008/oracle.yaml","role":"structural acceptance oracle","fingerprint":{"algorithm":"git_blob_sha1","value":"1fff585dd5e2a56a6a7aa7dc7eb6c4e5b558b2c8"}}],"scientific_decisions":[{"path":"registry/domain-finalization/values/feature-status.yaml","role":"authoritative inventory and status"},{"path":"registry/domain-finalization/values/module-specification.yaml","role":"domain operation and non-invention policy"},{"path":"registry/domain-finalization/values/patterns.yaml","role":"preservation and ordering rules"},{"path":"registry/domain-finalization/values/decision-required.yaml","role":"preserved unresolved decisions"}]}